{
  "api_version": "0.1",
  "id": "test_message_4",
  "name": "Test Message 4",
  "translatable": false,
  "type": "message",
  "conditions": {
    "end_time": 1599424544
  },
  "message": {
    "id": "test_message_4",
    "title": "Test Message 4 - Title",
    "subtitle": "Test Message 4 - Subtitle",
    "date": 1641406997,
    "blocks": []
  }
}
